id,title,score,num_comments,author,created_utc,url,over_18,edited,spoiler,stickied
1kodif8,Best local database option for a large read-only dataset (>200GB),42,21,-MagnusBR,1747433951.0,https://www.reddit.com/r/dataengineering/comments/1kodif8/best_local_database_option_for_a_large_readonly/,False,False,False,False
1kopm00,What are the major transformations done in the Gold layer of the Medallion Architecture?,43,24,kumaranrajavel,1747476837.0,https://www.reddit.com/r/dataengineering/comments/1kopm00/what_are_the_major_transformations_done_in_the/,False,False,False,False
1koi8s6,What do “good requirements” look like?,24,16,posersonly,1747448361.0,https://www.reddit.com/r/dataengineering/s/qOqSmbFi9O,False,False,False,False
1koqyra,Traditional ETL dev to data engineer,16,7,Connect_Cod_1783,1747482095.0,https://www.reddit.com/r/dataengineering/comments/1koqyra/traditional_etl_dev_to_data_engineer/,False,False,False,False
1kouhgg,How do experienced data engineers handle unreliable manual data entry in source systems?,15,8,poopdood696969,1747492618.0,https://www.reddit.com/r/dataengineering/comments/1kouhgg/how_do_experienced_data_engineers_handle/,False,False,False,False
1kotr7w,Advice on Data Pipeline that Requires Individual API Calls,13,20,pswagsbury,1747490620.0,https://www.reddit.com/r/dataengineering/comments/1kotr7w/advice_on_data_pipeline_that_requires_individual/,False,False,False,False
1kozikh,What are the newest technologies/libraries/methods in ETL Pipelines?,15,8,abdullahjamal9,1747505874.0,https://www.reddit.com/r/dataengineering/comments/1kozikh/what_are_the_newest_technologieslibrariesmethods/,False,False,False,False
1kovwnc,Data Engineers: How do you promote your open-source tools?,10,0,GeneBackground4270,1747496389.0,https://www.reddit.com/r/dataengineering/comments/1kovwnc/data_engineers_how_do_you_promote_your_opensource/,False,False,False,False
1kotkn1,insert-tools — Python CLI for type-safe bulk data insertion into ClickHouse,9,1,PrestigiousSquare915,1747490126.0,https://github.com/castengine/insert-tools,False,False,False,False
1kowycp,What is the best strategy for using Duckdb in a read-simultaneous scenario?,7,1,pkuligowski,1747499113.0,https://www.reddit.com/r/dataengineering/comments/1kowycp/what_is_the_best_strategy_for_using_duckdb_in_a/,False,False,False,False
1kp2puy,Am I too old?,13,11,evolutionIsScary,1747514317.0,https://www.reddit.com/r/dataengineering/comments/1kp2puy/am_i_too_old/,False,False,False,False
1konlpi,Looking for someone to review Dagster-Dbt-Dlt-DuckDb Project,4,9,Snoo54878,1747468184.0,https://www.reddit.com/r/dataengineering/comments/1konlpi/looking_for_someone_to_review_dagsterdbtdltduckdb/,False,False,False,False
1kok80s,Update existing facts?,4,5,RDTIZGR8,1747455006.0,https://www.reddit.com/r/dataengineering/comments/1kok80s/update_existing_facts/,False,False,False,False
1kp0ldl,Efficiently Detecting Address & Name Changes Across Large US Provider Datasets (Non-Exact Matches),2,1,incremental_load,1747508685.0,https://www.reddit.com/r/dataengineering/comments/1kp0ldl/efficiently_detecting_address_name_changes_across/,False,False,False,False
1kofg05,Transitioning from BI to Data Engineering – Sharing Real-World Project Insights Beyond the Tech Stack,2,5,baseball_nut24,1747439470.0,https://www.reddit.com/r/dataengineering/comments/1kofg05/transitioning_from_bi_to_data_engineering_sharing/,False,False,False,False
1kovmax,The Crag data team?,1,0,Snoo54878,1747495636.0,https://www.reddit.com/r/dataengineering/comments/1kovmax/the_crag_data_team/,False,False,False,False
1kot1l7,Footcrawl - Asynchronous webscraper to crawl data from Transfermarkt,1,0,Dependent_Cap5918,1747488596.0,https://github.com/chonalchendo/footcrawl,False,False,False,False
1kopot4,Demand for Talend,1,4,Any-Union-4787,1747477159.0,https://www.reddit.com/r/dataengineering/comments/1kopot4/demand_for_talend/,False,False,False,False
1kolkci,Seeking Focused Learning Resources for Microsoft SQL Server Aligned with Azure Data Engineer Role,1,2,True-Metal4045,1747459975.0,https://www.reddit.com/r/dataengineering/comments/1kolkci/seeking_focused_learning_resources_for_microsoft/,False,False,False,False
1koim5p,Skills required for DE vs SWE?,0,7,TimidHuman,1747449567.0,https://www.reddit.com/r/dataengineering/comments/1koim5p/skills_required_for_de_vs_swe/,False,False,False,False
1koi2fb,Getting AI to write good SQL: Text-to-SQL techniques explained,0,0,gman1023,1747447784.0,https://cloud.google.com/blog/products/databases/techniques-for-improving-text-to-sql,False,False,False,False
